"","title","username","date","stars","content"
"171","The Lion King","Dontcallmekeys","21 July 2005",1010,"Ah...""The Lion King."" There's so much I can say about this movie but all my comments always come down to one thing: this movie is beautiful. Pure genius. A timeless story. I might be a little biased in my beliefs, seeing as the first movie I remember seeing in theatres is ""The Lion King"" and I still watch it on a regular basis and know all the words but I'm sure there are plenty of people out there who agree with what I have to say. ""The Lion King"" is beautiful; hands down, it is the best Disney film ever created.The story is something that everyone can relate to, whether they are a lion ;) or not. Simba is destined to become king one day and just can't wait to rule the throne; everyone can relate to wanting to grow up and become an adult, to do whatever they want and not have to worry about anything. His father tries to teach him that, despite the fact that he will one day be grown and king, his life will not be easy. Simba has to learn his lesson the hard way when his Uncle Scar, who, too, wants the throne, kills his father and convinces Simba that it was his fault. Suddenly, growing up doesn't seem so great anymore (I can *really* relate to that).And so, Simba flees his home and comes across Timon and Pumbaa, two other outcasts. They teach Simba the ""Hakuna Matata"" lifestyle, something that idealizes a life free of stress, worry and responsibility. Now, don't we all wish we could live this way? No worries for the rest of our days... But when Simba's childhood friend Nala returns, he realizes that he can't live Hakuna Matata forever, for he does have a responsibility to his pride and his homeland. Simba understands that he must grow up, as we all do, and does what's right.The songs are catchy and fit the movie well (the original songs, of course, though ""The Morning Report"" isn't too bad) and the score is haunting and beautiful. Along with the art work, the music captures the heart of Africa.With the types of shows that children watch these days (boy, doesn't that make me sound old?), it's a wonder they'll learn in virtues and values at all. ""The Lion King"" is a great teacher when it comes to learning lessons that will carry throughout their lifetime. ""The Lion King"" teaches children that it's all right to be a kid but you must understand and accept responsibility for things you can and cannot control. Everyone has a place in The Circle of Life and we must find it; the film also teaches that we will encounter bad and even terrible things during our lifetime but we must accept them and move on. These are important, meaningful lessons; heck, I even used them in my SAT essay! ""The Lion King"" is a film for every generation and is a powerful film that all children should see. I'm past my childhood now and I still watch it whenever I get the chance; I look forward to sharing it with my children.A timeless film!"
"172","The Lion King","miadarlingtxn","23 August 2017",910,"this was, and still is,a great movie I love it, and hope that everyone gets to experience it for themselves, I've watched it many times and it is always good no matter how many times you have seen it,the songs are great and so are all the characters and the story is incredible, great for all ages and I really recommend it to anyone who hasn't already watched it."
"173","The Lion King","OllieSuave-007","1 November 2013",810,"This movie's story was written solely by Disney Studios, about a young lion, Simba, who was forced into exile by his evil Uncle Scar, who wants to take control of the jungle before Simba claims it. Life in the jungle declines under Scar's rule as Simba abandons his identity and meets new friends, Timon and Pumbaa, in another part of the jungle.Roger Allers and Rob Minkoff directed an exciting movie, adopting more of what I think are some of mainstream Hollywood's intense drama and comedy styles, seen in such parts like Uncle Scar and his crafty hyena goons chasing away poor Simba like gangsters pursuing a helpless hero, and the parts of the more modern day jokes and punchlines made by Timon and Pumbaa. The movie is also full of drama and action that will attract an audience of all ages, providing a great source of entertainment. It is compelling to see how Simba tries to wrestle his way out of his doubts as he tries to find his true identity and compelling to see Simba's family try to overcome adversary under Scar's rule. This is also a powerful story about courage, duty and identity (noticable as Simba tries to find his way) and the importance of family. Hans Zimmer did a good job on the music score and Elton John wrote some memorable songs like ""Circle of Life"" and ""Can You Feel The Love Tonight."" The toe-tapping ""I Just Can't Wait To Be King"" is my favorite.The characters are likable and, like the plot's style, take on more of a mainstream Hollywood approach. This movie differs from the more earlier films such as ""Cinderella"" and ""The Jungle Book,"" and even the later films such as ""The Little Mermaid"" and ""Beauty and the Beast."" ""The Lion King"" doesn't have that Disney touch you've come to expect and love in many of the fairytale and adventure movies, signaling that Disney films have evolved immensely over time. Even though it's not one of the more conventional Disney films, ""The Lion King"" is still a very good movie to watch due to its original concept, captivating story and memorable characters.Grade B+"
"174","The Lion King","dipto31121978","16 July 2017",1010,"""The best movie I ever watched in any form or any in language"".No, I am not exaggerating! It is the best movie ever, whether in human form or in animated. I can't find a single flaw in The Lion King (1994). Someone could argue that the story is not original, Disney just twisted it. Someone could also argue that i didn't watch that much of movies to judge ""The Best Ever"" but as I said, this the best movie I ever saw. The story is nice and free flowing and without any unnecessary bumpers. One can not recognized the voices behind the characters, because the characters are so prominent. Music! Let me say I am not very fond of English pop songs, but I could hum almost most of the songs of this movie, so I would say, music is that nice. Animation is superb, landscapes are eye catching, dialogues are sharp and comedy is at its best. What more might I say?Beside everything, you can say how crazy I am about this movie by my name. Enjoy the movie, don't leave the seat. Hakuna Matata!"
"175","The Lion King","Boba_Fett1138","26 June 2004",910,"""The Lion King"" is and will always will be regarded as one of the better Disney movies. And it deserves that!First of all the movie looks visually splendid! The African land scape's are beautiful and so are the animations of the animals itself.What makes ""The Lion King"" such a special movie is the emotional dept the story has. The story plays a significant role in the movie and it has some good adult moments. The entire movie has a more of an adult feeling, unlike earlier made Disney's that mainly focused on only young children. Still there also is plenty to enjoy for the young ones, especially the characters Timon and Pumbaa shall be loved by them.The story is filled with symbolism and reference to mainly the communist regime.The voice cast is good, mainly of course thanks to James Earl Jones who has an amazing good deep voice. Also the three hyenas are voiced perfectly by Whoopi Goldberg, Cheech Marin and Jim Cummings. Jeremy Irons who voices the main villain Scar really brings his character to live and makes the movie even more worth watching.There are some typical Disney songs that are good. Also surprising good is the musical score itself composed by Hans Zimmer who also received an Oscar for it. His first and only one but hopefully not his last. Also Tim Rice and Elton John received an Oscar for the song "" Can You Feel the Love Tonight"" and were nominated for two other songs from this movie.A must see animated movie with some scene's and songs that you'll not easily forget.9/10http://bobafett1138.blogspot.com/"
"176","The Lion King","Smells_Like_Cheese","31 October 2003",1010,"Seriously, I know that sounds stupid as this is an animated movie, but why can't we have a favorite movie that's animated? If you ask me this is Disney's best animated film of all time. Why do you ask? The animation is just beautiful, the story is powerful and moving, the characters are terrific, the villain is one of Disney's most monstrous and the songs are out of this world incredible! Not only is it my favorite animated movie, this is one of my favorite soundtracks, with the strong power of Elton John The Lion King is absolutely beautiful and a pleasure to watch still to this day. I have to say also that this story is just so beautiful, it's still one of the movies that will always bring a tear to my eye. When I was 17 years old, I begged my dad to take me to the re-release of The Lion King, him and I being the only adults besides the parents who took their children to see the movie, Simba's father dies and I started balling! My dad looks around and said ""Krissy, stop it!"" and I just said ""But it's so saaaaad! Simba's daddy!"", yes I'm a sap, I can't help it, this is a powerful movie.In the Pride Lands, Rafiki, a wise old monkey, anoints Simba, the newborn cub of King Mufasa and Queen Sarabi, and presents him to a gathering of animals at Pride Rock. Taking advantage of the cub's naive nature, Simba's scheming uncle Scar, who is very angry because Simba's birth means that he's no longer next in line to the throne tells him about the elephant graveyard, a place where Mufasa has forbidden Simba to go. Simba asks his mother if he can go to the water-hole with his best friend, Nala, but they go to the graveyard instead. There, the cubs are met by Shenzi, Banzai and Ed, 3 hyenas who try to kill them, but they are rescued by Mufasa. But Scar doesn't give up there, he lures Simba into a gorge for a ""surprise from his father"" while the hyenas create a wildebeest stampede. Alerted by Scar, Mufasa races to rescue Simba from the stampede. He saves his son but is left clinging to the edge of a steep cliff. Scar flings his brother into the stampede below. Simba sees his father fall and rushes down the cliff after him, only to find him dead. Scar convinces Simba that he was responsible for his father's death and recommends that he runs away from the Pride Lands to avoid punishment. In a distant desert, Simba is found unconscious by Timon and Pumbaa, a duo who adopt and raise the cub under their worry-free philosophy, Hakuna Matata. When Simba has grown into an adult he is discovered by Nala, who tells him that Scar, through his irresponsibility, has turned the Pride Lands into a barren wasteland. She asks Simba to return and take his place as king but Simba refuses, still believing he caused his father's death. Rafiki arrives and persuades Simba to return to the Pride Lands, and face Scar once and for all.I know that still that Beauty and the Beast is the only animated film to get a best picture nomination, but I don't understand why The Lion King didn't get the same treatment. I adore this film with such a passion, I will always defend it to the high end. I still watch this movie, ever since it's theatrical release in 1994, I still sing, dance, and rehears the lines back and forth. How could you not at least with Hakuna Matata? Timon is my idol, he's so care free, funny, and awesome during his drag hula scene ""Luau! If you're hungry for a hunk of fat and juicy meat, eat my buddy Pumbaa here, 'cause he's a tasty treat come on down and dine, on this tasty swine, all you gotta is get in line, are you achin',? For some bacon? He's a big pig. You can be a big pig, too. Oy! Ahhhh!"", best scene ever in film history! OK, not in history, but one of my favorites, it always has me on the floor laughing till my stomach hurts. If you seriously haven't seen this movie, see it! Who said that animated movies can't be true art? The Lion King is a fantastic film and deserves all it's praise and more.10/10"
"177","The Lion King","Quinoa1984","1 January 2000",1010,"The Lion King is a great film.  Along with a great story (inspired by William Shakespeare's Hamlet), terrific animation, and an all star cast of voices, there are the lessons that are learned from this film (despite being a little rough for the younger children).  Like responsibility and honor.I rank this animated film among the great films I have ever seen.  It was part of my childhood and it is a film experience I will never forget.  And hopefully, you won't either.  A++"
"178","The Lion King","claudonio","20 January 2000",1010,"This is a film that can entertain anyone young or old, I usually don't care for animated movies but this film is the real deal, this is one of disney's best animated movies. The animation is top notch and flawless. This film also features superb work from the vocal cast James Earl Jones, Jeremy Irons, Whoopi Goldberg. This is a standout."
"179","The Lion King","Special-K88","14 March 2002",NA,"Delightful animated feature from Walt Disney Pictures about a naive young lion cub destined for greatness. Born the son of a beloved and authoritative king he's groomed to be the next ruler of the kingdom, but along the way he encounters tragic detours at the hands of his villainous uncle and scheming hyena henchmen. Years later—as an adult—he decides to embrace his destiny and take his proper place in the Circle of Life. Warm, intelligent, laugh-out loud funny film is a triumph in every aspect; unforgettable songs, snappy dialogue, remarkable animation, and a stellar cast of voices make this a treat for all ages. A rousing adventure that you can enjoy again and again, and arguably one of the finest animated films ever made. ****"
"180","The Lion King","tfrizzell","3 July 2002",NA,"Outstanding animated feature from Disney that sports outstanding songs by Elton John, a compelling story and first-class animation. Young lion cub Simba is to be king, but he leaves after he believes he was the reason for his father's death (of course this is not so). As he grows up, he goes on a journey of love, friendship and discovery which will lead him back to his rightful place in the world. Excellent. 5 stars out of 5."
"181","The Lion King","ProfessorIMDb","11 February 2020",NA,"A film that only get better with repeat viewings and age, The Lion King is a fantastic animated masterpiece that is among Disney's finest achievements. Stellar voice work, great musical score, beautiful to look at and emotionally complex and riveting."
"182","The Lion King","movieguy1021","28 December 2002",910,"Released Christmas Day in 2002 to IMAX and large format screens, The Lion King makes a triumphant return to the screen after eight years. Its every bit as majestic and great as it has been before.The Lion King Mufasa (James Earl Jones) just had a baby cub named Simba. All of the animals come to the ceremony, except for Mufasa's brother Scar (Jeremy Irons). Scar desperately wants to be King, but can't. As long as Mufasa and Simba are there. Soon Simba is able to walk and talk and is voiced by Jonathon Taylor Thomas. After hearing about an elephant graveyard from Scar, he and his friend Nala (Niketa Calame) visit it. They meet three bumbling hyenas: Banzai (Cheech Marin), Shenzi (Whoopi Goldberg), and Ed (Jim Cummings), but they manage to leave unhurt. Scar is upset that the hyenas didn't do the job, so he orders a stampede to wipe out both of them, but it only takes care of Mufasa. Scar convinces Simba that he killed Mufasa, not Scar. So Simba flees into exile.The Lion King really benefits from the larger screen. Its lavish landscapes will be able to capture you more, and you can really savor the animation. Disney didn't need any humans, so they could spend all of the time on a great story and lush landscapes. In fact, its camera movement was so majestic that you actually felt like you were part of the pride of lions.The music boomed and really created the atmosphere. Although I had seen this picture before, I still was tense because of the way the music played out. Most of the time, I would just roll my eyes at the attempt to make me nervous. But Hans Zimmer's music really bowled me over and made my heart do calisthenics. Unlike such new Disney pics like Lilo and Stitch, the songs actually did some good. They took you out of a somewhat dreary mood and put a smile on your face and made your feet want to tap along. There were only a few, but they were very entertaining. And the Circle of Life song at the beginning was beautiful, with its perfect pictures and perfect sound.I really like James Earl Jones (he's pretty diverse), and this time was no exception. He seemed to act like he didn't want to do this role, but he couldn't contain his excitement for wanting to do voice-overs again (he had done some work in The Simpsons before). Matthew Broderick redeemed himself for me (after the atrocious Ferris Bueller's Day Off) by showing a strong voicing as the adult Simba. Cheech Marin, Whoopi Goldberg, and Jim Cummings really had good chemistry together, even though they didn't have much screen time. Irons was really good and creepy as Scar (one of those who you can't help but hate), and if that is him really singing, brava!Be warned, The Lion King isn't really for youngsters. It had intense thematic elements that should have warranted a PG, instead of those that don't deserve it (Lilo and Stitch, again). The mood that the music and the script brought out could damper your day, so be warned.This is one movie where you can feel for the characters. You don't say `haha, he's dead', you say `Gasp! I'm so sad!' If it weren't for the gifted scriptwriters, this movie would be kaput and a nothing, not the best Disney movie ever made.The Lion King is a majestic movie, not without humor, that is for almost all to see.My rating: 9/10Rated G for intense thematic elements."
"183","The Lion King","gdswalia","10 May 2005",1010,"The best Disney animated film ever...This film had it all, it was funny, emotional, had family drama, and above all, great animation and songs! My personal favorite character is Rafiki, the Baboon! I still cant forget the line he says to Simbe, ""Past can hurt, but as I see it, you can either run from it, or learn from it!"" it is so true! i loved Zazu's weirdness, and shenzi's humor, above all, i loved Pumba's innocence and Timon's intelligence! In short, i found the film the best film ever... The voice cast is also great. Mathew did complete justice to Simba, and what can I say about Mufasa, He is the best King, and dad anyone can ever get! The movie is not meant for kids, its meant to teach every adult a lesson...to find our place in the great ""Circle Of Life"". I give this film a perfect 10."
"184","The Lion King","TheLittleSongbird","17 February 2009",1010,"This is a fantastic movie, and I am not lying! my 13 year old sister loves this movie, and I can't fault this either. It was one of the first movies I ever saw, so that accounts for how much I love it. The animation is superb, the backgrounds look so rich, and for once, there are no stiff movements. The highlights were the stampede and the fight between Scar and Simba. The music by Hans Zimmer is outstanding, a perfect mix of African chants and pure Hollywood. The songs are absolutely great, I had no idea that Elton John could write like that. The best song is ""Can you feel the Love Tonight?"" but the others go without fault, ""Circle of Life"" is so spirit rousing especially. Likewise with the voice overs. Jonathan Taylor Thomas is very likable as Young Simba, and Matthew Broderick, while not as good, is above average too. James Earl Jones lends his booming voice to the majestic King Mufassa, and Nathan Lane, Rowan Atkinson and Whoopi Goldberg provide flawless comic relief. The vocal standout is Jeremy Irons as Scar, who frightened me when I was little. Scar is up there with the best Disney villains, like Jafar, Malificent and Frollo. The humour here is fantastic, and you cry here a bit here as well. I highly recommend the stage version in the West End, and the sequels are actually two of the better DTV sequels.10/10. Bethany Cox"
"185","The Lion King","chadgeri","22 April 2002",1010,"This movie is, quite seriously, the Citizen Kane of Disney animation. Every animated movie from Disney ever since has been a failed attempt to recreate the masterpiece that this film is. This movie is an anomaly in a market usually dominated by formulaic kiddie-fare. Unlike most films from animation studios, this movie will enthrall you, whether you're 5 years old, or 50. An epic plot, intriguing characters, great music and hillarious moments make this film a family classic that will endure through the ages. 10/10"
"186","The Lion King","kaydrelia","21 July 2019",1010,"Watched the new one, and I think I had a disgusted look on my face the entire time. The music, the visuals, the dialogue, the voice acting, etc. Rewatched this one and remembered why this was my favorite Disney movie growing up. From mufasa's death to the goofy hyenas, to the bond between rafiki, simba and mufasa. The music that everyone knows every word to, and scar's ability to deliver each line perfectly. This movie is magic, the new one seems to tech focused and forgot what made lion king so beloved to begin with, its unfortunate. Hoping the circle of life makes it way around and the end of remakes draws close (see what I did there lol). Until then, lion king from the 90s will stay on my shelf and my kids will watch with me. This new one will never end up in my cart and I wont confuse my kids by watching it either. Thank you 90s Disney for the magic!"
"187","The Lion King","Maintenance_Guys","7 August 2006",NA,"I find it hard to believe that kid's movies these days will ever be called classics in years to come (excluding Pixar movies). In my mind, this is the last classic hand drawn film, and it upsets me that I have to wait for another five years for it to come out on DVD. This film deals with great issues and involves a huge conflict for the main character, something that recent kid/family films lack. It is funny and lighthearted when it should be, and heartfelt and serious when it needs it. I believe that everybody should see this movie, regardless of your age. It may just be the last good movie that Disney will ever do without the help of Pixar."
"188","The Lion King","David_l_s","21 December 2005",1010,"I watched the film today and I have come to the conclusion that this Disney film is one classic that will keep on delivering to Disney fans like myself...TLK is a wonderful film with great characters and songs with a powerful message that you can always find your way back no matter how hard the journey...I think The Lion King is one of the best Disney animated films matching with the power of Bambi and Brother Bear.I love how Disney Works hard to deliver the best in Animation,Song,And MagicI do believe that 2006 and many years from now The Lion King will Shine and still Roar with Success...Thank-You Disney For The Lion King"
