"","title","username","date","stars","content"
"253","The Lion King","claudonio","20 January 2000",1010,"This is a film that can entertain anyone young or old, I usually don't care for animated movies but this film is the real deal, this is one of disney's best animated movies. The animation is top notch and flawless. This film also features superb work from the vocal cast James Earl Jones, Jeremy Irons, Whoopi Goldberg. This is a standout."
"254","The Lion King","Special-K88","14 March 2002",NA,"Delightful animated feature from Walt Disney Pictures about a naive young lion cub destined for greatness. Born the son of a beloved and authoritative king he's groomed to be the next ruler of the kingdom, but along the way he encounters tragic detours at the hands of his villainous uncle and scheming hyena henchmen. Years later—as an adult—he decides to embrace his destiny and take his proper place in the Circle of Life. Warm, intelligent, laugh-out loud funny film is a triumph in every aspect; unforgettable songs, snappy dialogue, remarkable animation, and a stellar cast of voices make this a treat for all ages. A rousing adventure that you can enjoy again and again, and arguably one of the finest animated films ever made. ****"
"255","The Lion King","tfrizzell","3 July 2002",NA,"Outstanding animated feature from Disney that sports outstanding songs by Elton John, a compelling story and first-class animation. Young lion cub Simba is to be king, but he leaves after he believes he was the reason for his father's death (of course this is not so). As he grows up, he goes on a journey of love, friendship and discovery which will lead him back to his rightful place in the world. Excellent. 5 stars out of 5."
"256","The Lion King","ProfessorIMDb","11 February 2020",NA,"A film that only get better with repeat viewings and age, The Lion King is a fantastic animated masterpiece that is among Disney's finest achievements. Stellar voice work, great musical score, beautiful to look at and emotionally complex and riveting."
"257","The Lion King","movieguy1021","28 December 2002",910,"Released Christmas Day in 2002 to IMAX and large format screens, The Lion King makes a triumphant return to the screen after eight years. Its every bit as majestic and great as it has been before.The Lion King Mufasa (James Earl Jones) just had a baby cub named Simba. All of the animals come to the ceremony, except for Mufasa's brother Scar (Jeremy Irons). Scar desperately wants to be King, but can't. As long as Mufasa and Simba are there. Soon Simba is able to walk and talk and is voiced by Jonathon Taylor Thomas. After hearing about an elephant graveyard from Scar, he and his friend Nala (Niketa Calame) visit it. They meet three bumbling hyenas: Banzai (Cheech Marin), Shenzi (Whoopi Goldberg), and Ed (Jim Cummings), but they manage to leave unhurt. Scar is upset that the hyenas didn't do the job, so he orders a stampede to wipe out both of them, but it only takes care of Mufasa. Scar convinces Simba that he killed Mufasa, not Scar. So Simba flees into exile.The Lion King really benefits from the larger screen. Its lavish landscapes will be able to capture you more, and you can really savor the animation. Disney didn't need any humans, so they could spend all of the time on a great story and lush landscapes. In fact, its camera movement was so majestic that you actually felt like you were part of the pride of lions.The music boomed and really created the atmosphere. Although I had seen this picture before, I still was tense because of the way the music played out. Most of the time, I would just roll my eyes at the attempt to make me nervous. But Hans Zimmer's music really bowled me over and made my heart do calisthenics. Unlike such new Disney pics like Lilo and Stitch, the songs actually did some good. They took you out of a somewhat dreary mood and put a smile on your face and made your feet want to tap along. There were only a few, but they were very entertaining. And the Circle of Life song at the beginning was beautiful, with its perfect pictures and perfect sound.I really like James Earl Jones (he's pretty diverse), and this time was no exception. He seemed to act like he didn't want to do this role, but he couldn't contain his excitement for wanting to do voice-overs again (he had done some work in The Simpsons before). Matthew Broderick redeemed himself for me (after the atrocious Ferris Bueller's Day Off) by showing a strong voicing as the adult Simba. Cheech Marin, Whoopi Goldberg, and Jim Cummings really had good chemistry together, even though they didn't have much screen time. Irons was really good and creepy as Scar (one of those who you can't help but hate), and if that is him really singing, brava!Be warned, The Lion King isn't really for youngsters. It had intense thematic elements that should have warranted a PG, instead of those that don't deserve it (Lilo and Stitch, again). The mood that the music and the script brought out could damper your day, so be warned.This is one movie where you can feel for the characters. You don't say `haha, he's dead', you say `Gasp! I'm so sad!' If it weren't for the gifted scriptwriters, this movie would be kaput and a nothing, not the best Disney movie ever made.The Lion King is a majestic movie, not without humor, that is for almost all to see.My rating: 9/10Rated G for intense thematic elements."
"258","The Lion King","gdswalia","10 May 2005",1010,"The best Disney animated film ever...This film had it all, it was funny, emotional, had family drama, and above all, great animation and songs! My personal favorite character is Rafiki, the Baboon! I still cant forget the line he says to Simbe, ""Past can hurt, but as I see it, you can either run from it, or learn from it!"" it is so true! i loved Zazu's weirdness, and shenzi's humor, above all, i loved Pumba's innocence and Timon's intelligence! In short, i found the film the best film ever... The voice cast is also great. Mathew did complete justice to Simba, and what can I say about Mufasa, He is the best King, and dad anyone can ever get! The movie is not meant for kids, its meant to teach every adult a lesson...to find our place in the great ""Circle Of Life"". I give this film a perfect 10."
"259","The Lion King","TheLittleSongbird","17 February 2009",1010,"This is a fantastic movie, and I am not lying! my 13 year old sister loves this movie, and I can't fault this either. It was one of the first movies I ever saw, so that accounts for how much I love it. The animation is superb, the backgrounds look so rich, and for once, there are no stiff movements. The highlights were the stampede and the fight between Scar and Simba. The music by Hans Zimmer is outstanding, a perfect mix of African chants and pure Hollywood. The songs are absolutely great, I had no idea that Elton John could write like that. The best song is ""Can you feel the Love Tonight?"" but the others go without fault, ""Circle of Life"" is so spirit rousing especially. Likewise with the voice overs. Jonathan Taylor Thomas is very likable as Young Simba, and Matthew Broderick, while not as good, is above average too. James Earl Jones lends his booming voice to the majestic King Mufassa, and Nathan Lane, Rowan Atkinson and Whoopi Goldberg provide flawless comic relief. The vocal standout is Jeremy Irons as Scar, who frightened me when I was little. Scar is up there with the best Disney villains, like Jafar, Malificent and Frollo. The humour here is fantastic, and you cry here a bit here as well. I highly recommend the stage version in the West End, and the sequels are actually two of the better DTV sequels.10/10. Bethany Cox"
"260","The Lion King","chadgeri","22 April 2002",1010,"This movie is, quite seriously, the Citizen Kane of Disney animation. Every animated movie from Disney ever since has been a failed attempt to recreate the masterpiece that this film is. This movie is an anomaly in a market usually dominated by formulaic kiddie-fare. Unlike most films from animation studios, this movie will enthrall you, whether you're 5 years old, or 50. An epic plot, intriguing characters, great music and hillarious moments make this film a family classic that will endure through the ages. 10/10"
"261","The Lion King","kaydrelia","21 July 2019",1010,"Watched the new one, and I think I had a disgusted look on my face the entire time. The music, the visuals, the dialogue, the voice acting, etc. Rewatched this one and remembered why this was my favorite Disney movie growing up. From mufasa's death to the goofy hyenas, to the bond between rafiki, simba and mufasa. The music that everyone knows every word to, and scar's ability to deliver each line perfectly. This movie is magic, the new one seems to tech focused and forgot what made lion king so beloved to begin with, its unfortunate. Hoping the circle of life makes it way around and the end of remakes draws close (see what I did there lol). Until then, lion king from the 90s will stay on my shelf and my kids will watch with me. This new one will never end up in my cart and I wont confuse my kids by watching it either. Thank you 90s Disney for the magic!"
"262","The Lion King","Maintenance_Guys","7 August 2006",NA,"I find it hard to believe that kid's movies these days will ever be called classics in years to come (excluding Pixar movies). In my mind, this is the last classic hand drawn film, and it upsets me that I have to wait for another five years for it to come out on DVD. This film deals with great issues and involves a huge conflict for the main character, something that recent kid/family films lack. It is funny and lighthearted when it should be, and heartfelt and serious when it needs it. I believe that everybody should see this movie, regardless of your age. It may just be the last good movie that Disney will ever do without the help of Pixar."
"263","The Lion King","David_l_s","21 December 2005",1010,"I watched the film today and I have come to the conclusion that this Disney film is one classic that will keep on delivering to Disney fans like myself...TLK is a wonderful film with great characters and songs with a powerful message that you can always find your way back no matter how hard the journey...I think The Lion King is one of the best Disney animated films matching with the power of Bambi and Brother Bear.I love how Disney Works hard to deliver the best in Animation,Song,And MagicI do believe that 2006 and many years from now The Lion King will Shine and still Roar with Success...Thank-You Disney For The Lion King"
"264","The Lion King","moviesleuth2","9 August 2009",1010,"Of all the animation classics from the Walt Disney Company, there is perhaps none that is more celebrated than ""The Lion King."" Its acclaim is understandable: this is quite simply a glorious work of art.""The Lion King"" gets off to a fantastic start. The film's opening number, ""The Circle of Life,"" is outstanding. The song lasts for about four minutes, but from the first sound, the audience is floored. Not even National Geographic can capture something this beautiful and dramatic. Not only is this easily the greatest moment in film animation, this is one of the greatest sequences in film history.The story that follows is not as majestic, but the film has to tell a story. Actually, the rest of the film holds up quite well. The story takes place in Africa, where the lions rule. Their king, Mufasa (James Earl Jones) has just been blessed with a son, Simba (Jonathan Taylor Thomas), who goes in front of his uncle Scar (Jeremy Irons) as next in line for the throne. Scar is furious, and sets in motion plans to usurp the throne for himself. After a tragedy occurs and Mufasa is killed, Scar persuades Simba to flee, leaving himself as king. Simba grows up in exile, but he learns that while he can run away from his past, he can never escape it.When viewing the film, it is obvious that ""The Lion King"" is quite different from its predecessors (and successors). This is an epic story that contains more dramatic power than all the other Disney films combined. While there are definitely some light-hearted moments, there is no denying the dark drama that takes up the bulk of the story. While it could be argued that Disney is the champion of family entertainment, this film is not for the very young. Some of the sequences are very dark and violent, many bordering on frightening, even for the older crowd.The voice actors are terrific. Jonathan Taylor Thomas brings a large dose of innocence to Young Simba. He's mischievous, but also terribly naive. His older counterpart, voiced by Matthew Broderick, equals him. He's older, but no less mature. The voices are so similar that it's almost impossible not to believe that they are the same character at different ages. Perhaps no one could have been better suited for the role of Mufasa than James Earl Jones. His baritone voice gives the Mufasa a quality of great power and wisdom; there is no question that his role is king. As Scar, Jeremy Irons is pitch-perfect. The drawing of the character is villainous, but Irons' vocal work complements the animation to create one of the most memorable, and vicious, villains in Disney history. He's unquestionably evil, but he's also clever, which makes him all the more dangerous. Manipulation, not violence is his greatest weapon. Providing some much needed comic relief are Nathan Lane and Ernie Sabella as Timon and Pumbaa, two other outcasts (a meerkat and a warthog), and Rowan Atkinson as Zazu. While there is definite fun from these characters, neither the actors nor the filmmakers allow them to go over-the-top and destroy the mood of the film.Disney's animated features are known for their gorgeous artwork. Nowhere is this more apparent than in ""The Lion King."" Every single frame is jaw-dropping. The colors are rich, and the drawings are sharp and beautiful. One of the pitfalls of animation (both computer and hand-drawn) is that there is sometimes a visible distance between the subject and the background, making it seem as if the figure animation was cut and pasted on the background (this is obviously what happens, but it is up to the artists to make sure that it isn't noticeable). There is none of that here.Throughout the Golden Age of Disney animation, the films have been musicals. ""The Lion King"" is no different, and the songs are brilliant. All of the numbers are standouts (""Can You Feel the Love Tonight"" won the Oscar, but in my opinion, ""The Circle of Life"" was better). In the cases of Simba and Nala (Simba's girlfriend), both young and old, there is a noticeable difference between the speaking and singing parts (everyone else does their own singing and speaking), but never mind. It still works, and that's what's important.""The Lion King"" is not flawless, but on first viewing, they aren't noticeable, and it is likely that the young won't ever notice them. ""Beauty and the Beast"" was the first animated film to get an Oscar nomination for Best Picture (it lost to ""The Silence of the Lambs""), and is thus far the only animated film to receive such an honor. That being the case, it's hard to understand why ""The Lion King"" was not given the same distinction. The two films are more or less equal in quality, and the nominees for the honor that year were not strong.If you haven't already, see ""The Lion King."" You won't be disappointed."
"265","The Lion King","Hitchcoc","28 March 2006",910,"This is an outstanding work of animation. I realize that it has been criticized for political incorrectness. The fact of the matter is that it has strong female characters as well as male, and it's about a vision of monarchy. I have the greatest respect for female role models but I really don't see this as a worthy criticism. It's a great story of defeat and betrayal and renewal. It has delightful individual characters, dressed up to show their beings in a clever way. It has the most despicable villains with Scar and the Hyenas. It has the Henry II thing about duty. It doesn't glorify fooling around as one of my colleagues told me. The free life is OK but at some time you must follow your heart and redeem yourself. The music is outstanding; another triumph or the Disney team. There are three or four numbers that are so critical to a complete understanding of the events of the story. The sound effects person should have been rewarded because sound is so critical in this. From the stampede to the forbidden areas of the kingdom. I watched this about sixty times with my small children and never really tired of it. I would put this at the top of any list of animated adventures."
"266","The Lion King","saveliydalmatov","29 December 2023",1010,"Legendary and one of the best cartoons in history!!(and for me - the best. My mother even told me that I watched it every day as a child!)The tragic story is really instructive, beautiful landscapes and a very warm atmosphere that is memorable. The prescribed characters and the original idea - all this makes watching interesting for any age.Legendary music, beautiful animation and other things that will make you fall in love with this cartoon.It is very strange if someone has not seen this masterpiece yet. This is the classic that, although no one insists on, but it is desirable to know!"
"267","The Lion King","suicune_tudor","28 November 2005",1010,"This is truly one of the best Disney movies ever. I really enjoyed it when I first seen it, about when I was 6, and since then I watched it over and over again. I simply LOOOOVED the music. It's one of the best soundtracks I've ever heard. And, speaking of soundtrack, I just can't tell in words how much I love the song ""Can You Feel The Love Tonight"". Is one of my favorite songs ever. I truly believe that this motion picture could easily be nominated for The Best Picture, but The Best Song and the Best Original Score is really enough. I wonder if they will ever think to make a prequel of this movie in order to understand who is Mufasa, Scar, Sarabi and the other characters. In short, this movie will be remembered in the next 100 years. Truly."
"268","The Lion King","Sleepin_Dragon","21 June 2023",1010,"Animal rivalries spiral out of control as The King's heir pushes the original successor to challenge for the crown.I vowed to watch more Disney films, and tonight's random choice was The Lion King, regarded by many as the greatest of all, and I can understand why, the story is brilliant, the music is superb and the animation holds up nicely. It's a good old fashioned Disney story of good and evil.Young and old will love this film, I love it so much that I saw the stage play, the live action film and a re release a few years back. Seeing this on the big screen was worth it, the landscapes were breathtaking.I had preconceived ideas that this film won a host of Oscars, when I checked it out, I noticed it won two, both for the music, I'm a little surprised. The music is tremendous, Hans Zimmer and Elton John, what better mix could anyone wish for?The humorous moments are sublime, Zazu is hilarious, Rowan Atkinson is an absolute joy, so sarcastic, so funny. Whoopi Goldberg is also perfect as Shenzi, again so funny.The voices fit each and every character, James Earl Jones and Matthew Broderick shone, it wouldn't have worked without Jeremy Irons, what a talent.This film cannot be given any other score than....10/10."
"269","The Lion King","Lady_Targaryen","16 November 2005",1010,"The Lion King is a classic from Disney. I remember going to the movie theater/cinema and watching the film...I was exactly 8 years old. And until now, with 19 years old, the good sensation of watching this movie is the same as that time. My mother even bought me Simba's doll! =)The story takes place in Africa, where Simba, son of Mufasa, is very well protected by his dad.(sometimes with the help of Zazu, a bird that is kind of a counselor of the king Mufasa)Everything goes well, but there is one problem: Scar, Mufasa's brother, is jealous because he is not the king of the jungle, and decides to do a plan to kill Simba and Mufasa. Simba escapes, but Mufasa dies; Scar tells Simba that he is guilty for Mufasa's death,and the terrified Simba runs away, too sad of what happened. Far from his kingdom, Simba meets Pumbaa and Timon, who takes care of him and teaches about Hakuna's Matata philosophy. Everything will be very well for a long time, until Simba meet again his childhood friend Nala ,who tells him about the horrible things Scar is doing in the old Kingdom."
"270","The Lion King","thediggens","5 June 2014",910,"The Lion King is by general consensus the greatest Disney film from their glorious renaissance period (1989-1999), and is undoubtedly worthy of such recognition. Notably, it is the highest rated Western animation on IMDb's own Top 250, which while flawed and imprecise is a good indicator of quality.A loose adaption of Shakespeare's Hamlet, The Lion King is visually stunning, the peak of hand-drawn animation, with a strong voice cast and a wide selection of memorable tunes. It is a tight ~80 minutes, and one sometimes forgets just how quick the movie moves, yet it does so deftly. The characters are well defined, and the arc of Simba's growth, the core of the film, evolves satisfyingly. One could question whether more time should have been spent on Simba's growth in the middle act (there is incredulous imagery as Simba grows exponentially next to the stasis of Timon and Pumba), but to meander so would ask it to be an entirely different film.While it is not uncommon for a side character or two overshadow the main (see the Genie in Aladdin), Matthew Broderick and Jonathan Taylor Thomas (adult and young Simba respectively) are at risk from nearly all of the phenomenal cast. James Earl Jones is a commanding presence, and Jeremy Irons as Scar steals every scene. The 'fools' of the film, be it Timon & Pumba, the Hyena trio or even Zazu, all provide the levity believably, that would otherwise leave an incredibly sombre film. Nala is powerful, though one must note that she seems at times far more capable than Simba to actually achieve anything. Nevertheless, Simba's coming-of-age arc, while predictable, is enjoyable, helped along by fantastic charisma and choice songs.The fact that the film has spawned a wildly successful musical gives a strong indication of the quality of the music, but what is less said is how beautiful the film is. As The Lion King was being released, works were already moving away from hand-drawn animation, with Toy Story released a year later. And The Lion King might be the peak of hand-drawn, with an enormous palate of creativity and variety. The opening vista for 'Circle of Life', the bursts of colour in 'Can't wait to be King' and the sombre tone of 'Be Prepared' all are gorgeous. Yet, special mention must go to the Stampede scene, one of the finest scenes of animation ever.One thing I've developed from multiple viewings is how Timon and Pumba might be the weakest part of the movie. First, their 'life lessons' are essentially reversed by Rafiki. Certainly they are qualified to the point of being narratively sidelined. They feel contrived and even a detraction from the meat of the movie. Their role is the fast food portion of the film- the quick fix over more meatier bits of the film. The entertainment provided is enjoyable regardless, and is essential to round off the movie as Disney.The Lion King is endlessly re-watchable, catchy, fun, while remaining a fantastic piece of cinema and an invaluable part of the Disney canon. Magnificent."
